category,question,option1,option2,option3,option4,correct_answer,recommendation_type,recommendation_title,recommendation_link
softskills,"How do you handle a toxic coworker?","Engage in drama","Maintain professionalism and distance","Complain constantly","Fight back",2,w3schools,Workplace Relationships,https://www.w3schools.com/softskills/workplace_relationships.asp
softskills,"What is the most important quality for career success?","Technical skills only","Soft skills only","Combination of both","Luck",3,w3schools,Career Success,https://www.w3schools.com/softskills/career_success.asp
softskills,"How do you approach a performance review?","Get defensive","Be open to feedback and discuss growth","Argue every point","Skip it",2,w3schools,Performance Review,https://www.w3schools.com/softskills/performance_review.asp
softskills,"What is the best way to build confidence?","Compare to others","Celebrate small wins","Avoid challenges","Wait for perfection",2,w3schools,Self Confidence,https://www.w3schools.com/softskills/self_confidence.asp
softskills,"How do you handle success?","Stay humble and grateful","Brag about it","Ignore it","Take all credit",1,w3schools,Humility,https://www.w3schools.com/softskills/humility.asp
softskills,"What is the most important lesson for a professional?","Always be right","Continuous improvement","Work harder than everyone","Follow orders",2,w3schools,Professional Growth,https://www.w3schools.com/softskills/professional_growth.asp